,Tweet Id,Text,Username
3284,811779112603815937,"Me: I wanna make something of my life!
My depression: Life is meaningless. We are all wandering aimlessly until the sun eventually explodes.",KRYS_KANT_EVEN
3285,811777256557256704,Good to be back in the gym lifting regularly and eating better. Depression is a mother fucker.,new_young_god
3286,811767967621021696,Seasonal depression is real fam it needs to get warm again asap I'm trying to be on the water with some beer,Dong_Quixote_
3287,811777698934693889,#extreme depression and cannot lose weight kalpadruma online shopping,SkitRikk
3288,902690542185615360,Agree -- melancholia is not clinical depression. #mentalillness https://t.co/OBl2UFGOFp,PhilippaBateman
3289,902687678050783232,Depression is gonna kill me,JordannnLeeee
3290,811767494272806916,"“you look depressed”
thanks it’s the depression",samrw94
3291,811777520714608640,"""i don’t understand why people think that depression goes away on holidays?? like ho ho ho I’m still feliz navidying""",mbollig_
3292,811769299358519296,I don’t understand why people think that depression goes away on holidays?? like ho ho ho 💩💩,hanimamran_
3293,811769988474408960,@trancegeminii I have depression and spent all day sleeping so I wouldn't have to feel things,cqpricorn_
3294,811778138661273600,Holiday blues are feelings of anxiety or depression that many people experience during the holiday season. These... https://t.co/nZOQHJjA9r,NAMIRiverside
3295,811761982550310912,So Sydney was amazing and I have Post Sydney Depression. Hurry up 2 more years so I can finish up and move there!,LaurenMaree_91
3296,811760284796932096,"Another Bama basketball game, another night of depression.",Landry1117
3297,811765233874182144,@Sonia15434785 well MM makes me happy. it takes away my stress and depression. 😄 anyways my fave is seven and unknown. ^^,kimminori_
3298,811774050070630401,The things I read on https://t.co/jo1cagM8jV sends me into a serious depression,y0_kaythomas
3299,902691658919268353,"when did this depression shit become cool? like memes and shit? outlet that shit, don't play around with it",_jordanmh
3300,811774403558019073,I'm drunk and crying and playing Yahtzee is this depression?,WhitneyPuppy
3301,902690031239909377,"""Who are you? Can you believe these guys? Lecturing me on manic depression, like I couldn't write a book or two.""",Heart_A_Flame
3302,811772420205973504,"devoured #pleaselikeme on netflix. such a great, relatable, real show covering everything from love/break-ups to mental illness + depression",jen_kirsch
3303,811773871732854784,#HOLIDAY #BLUES: This #time of yr alot of #people #suffer w #depression #grief #trauma #stress &amp; #anxiety. #Leap @ the #opportunity 2 #help https://t.co/f6gPHT4F1N,Happy4Humankind
3304,902688747833090048,If that Farrelly piece stops one person trying to get chemical help for anxiety or depression it borders on criminal. FFS fairfax.,beeso
3305,811772280338608128,The day my depression doesn't keep me in bed will be the day,ninatringali
3306,811765922268676096,"hello, I'm alyssa and I have crippling depression:))",_alyssaedmiston
3307,811776386931097600,I hate how the dumbest and smallest things trigger my depression and send me spiraling,EstefansMenzel
3308,811759773683216385,Isolation can cause depression and physical pain and burnout #WorkLifeBalance #PTSDchat,DebraLindh
3309,811766714060849154,Q10: What resources can you suggest for people vulnerable to #anxiety or #depression during the holidays? #addictionchat,RecoveryInst
3310,902683529573740544,Depression state: just watched 15 minute video of vegetables and fruits being shredded,mellabella_merp
3311,811768349734699008,"@RomellHenryTgf TGF is getting me thru depression, thanks to u and jay so much 💙 il dm u my address and everything bro if u can cut my hair😉",TuTruTech
3312,902683786042859521,I dont like it when something I just beat comes right back at me with a new weapon of destruction to my mindset. I hate depression.,kaydeefoxx
3313,905538522295091200,I say this all the time. Depression isn't a feeling. It's a state of being.,VlRGO_
3314,902684714842148870,"There's going to be a sudden outbreak of ""depression"" in that whole family, methinks. #Clintoncide https://t.co/xQDrNTIUHI",DenierNyc
3315,811759562071998464,"@daleytwin1 nausea, acne, depression, debilitating pain, and I gotta keep going through my daily life to be made fun of for speaking up???",daleytwin1
3316,811767808505876482,Smoot-Hawley -&gt; Great Depression -&gt; Rise of fascism https://t.co/qChJCuimRB,johntandlich
3317,902690502385876992,Depression isn't cute bitch it's not trendy that I have lost YEARS of my life to disassociation and suicidal thoughts PLS STOP W THIS SHIT,djlilem
3318,811780222110597122,I think I just put myself in a depression,iTweetToArgue
3319,811771151995326464,@_Zerken Its your depression eating away at you. https://t.co/HAvgkOfyo4,HappyManSad
3320,811766232638689281,DEPRESSION SUM FUKSHIT I RLLY BE HAVING TO REMIND MYSELF TO DO SIMPLE SHIT LIKE WASH UR FACE BRUSH UR TEETH FIX UR HAIR EAT SOMETHING,mdmamerica
3321,903023148488122368,"The xans have a reverse effect on me.. I thought they cure depression, shit makes it worse until I pass out and wake up then I'm happy again",_Black_Hova_
3322,903025168926343168,Holy crap! I'm actually going to the gym!  I'm AMAZING!  #ButFirstTwitter #MiraclesDoHappen #Sober #Depression #ODAAT,Dayata_Time1
3323,902686769791029248,Wants stressing u the most; DEPRESSION I GUESS,joshuasunshine4
3324,905541053343817728,Im about to file for depression so I can bring Hunter to school as a service dog,hillard_matt
3325,811774286050586626,"I struggle with depression, in all directions I step in; reconsider my movements..",sophistikated_2
3326,811772094769983488,Why a diary helps with #depression. It allows you to be honest with yourself. https://t.co/T8qtBGvXsI #endthestigma https://t.co/ye2DMYtvSm,openforestnet
3327,811760630353039361,hey michigan hit me up with that seasonal depression,alexa_syd
3328,905541609869205504,"Natural Herbal Remedies for Anxiety, PMS, Depression and More Save 30% coupon from  - https://t.co/CRUnHukCLs",CouponAdvisor
3329,903023928167342081,"For all of my friends struggling with depression &amp;anxiety, etc I encourage you to watch this video. I love you all! https://t.co/rL21gC8lCE",shirlsbirls69
3330,811777781931442177,"All I want for Christmas: 
-my crippling anxiety and depression to end
-for carbs not to make me fat",alexusamiable
3331,902684439553200128,"Alcohol, Depression, Anxiety, Sleep, Anti-Social activity...yeah...there's more https://t.co/iINAhLVSek",themanyfacedgxd
3332,811771765819133952,@SofiaEclipsee Just let my depression get to me....,KrazyCries
3333,811764474940129288,When you're out bowling with your friends and your depression kicks in all of a sudden and it feels like you can't continue 🙃🙃🙃,Angrymemelover
3334,811778661456089088,@heartshoshi I MISSED U ALEX I WAS IN SEVERE DEPRESSION I WAS SO CLOSE TO BANGING MY HEAD ON OUR GATE ASJDHAKSJHD,sevngcheoIs
3335,811774473766637568,Getting Calios out of depression and as a tribute to the 4-24 Syracuse shot from behind the arc today,NateWithSports
3336,902685833291063296,My depression figured out I have the next 3 days off cause WOW IT'S HITTING ME HARD,katsouppp
3337,811763948089393152,"What parents need to know about self harming. #depression #teens #selfharming #cutting
https://t.co/nanQtIHIEk https://t.co/9Ctg9tMusi",netnanny
3338,902688177516711936,Quick Reminder: Depression is a disease. You can't change a loved one's depression. You can't magically cure them by changing yourself.,LianaBrooks
3339,811778945184137216,RZA mentions his pain and depression with his artistry and how his lover allowed him to overcome it.,OBUXUM
3340,902686526097825792,my ex has gotten SO much uglier since we broke up and he got back w his UGLY af ex gf so im blessed and prospering and my depression is gone,thiccameron
3341,811760422638391296,@KenRyuuS cause yall always bully me if I dont do that ill fall into depression cause of you guys 😥,Yeinsus
3342,811772832040493056,"The three stages of finding out a close friend got extremely hurt

Shock
Rage
Depression, Self blame and Sadness https://t.co/RoCyQiux3j",_KuroMeme_
3343,902692509532397568,I think about all the things i did yesterday and the day before and i don't even feel like the same person. thats the thing about depression,YoFizz
3344,905537626945589248,Too much depression in the air,bodyghosam
3345,811766723250622465,And now an actual fact: depression is the result of seratonin imbalances in your brain https://t.co/rXQjWpvIi5,champagnemamti
3346,811769048027439104,@Red_WaifyHunter yeah... she actually had a lung cancer when she was born and she fell into depression since she felt that she wont make it,YukiHana97
3347,811770001413832704,"#CHRISTIANITY

When Depression Hits Home - Audio
Family Minutes

https://t.co/pTRB09FZjZ
#PODCAST https://t.co/iFuW8UBZSb",podDVRstreams
3348,811781733804863489,"I'm just bored really. though I do have chronic depression but I don't think that's the problem, no I'm probably just tired.",Rain_Reptilian
3349,902688837645807617,Depression is tricky (tricky tricky tricky what!),rynsgirlfriend
3350,811780910307799047,"Think my anxiety/depression may finally be breaking. I hope. It's unpredictable, I get false starts sometimes. :p Get outta here, kid",sephyote
3351,902688346828410880,"If you’re struggling with extra weight, IBS, fatigue, eczema, or mild depression…or… https://t.co/cjyj1Xwvpe",daimanuel
3352,905543360865198080,STOP TELLING PEOPLE HOW TO DEAL WITH THEIR DEPRESSION AND EXPECTING THEM TO BE HAPPY AND LOVEY DOVEY AGAIN AFTER,titlefightera
3353,811759432547897344,"video of the camel (with the wrinkled knees) depression song that has 1 line down as ""no-one to come for you"". i think thatd be relaxing",polymerdespair
3354,811760686200131584,Excerpt from a link following: Scientists are also increasingly interested in the link between depression and... https://t.co/dyRySdM7Y6,DrEllenBlomerth
3355,905539493482115072,"All our Gods have abandoned us!
This is the great esoteric depression.
We sold our souls but couldn't buy salvation... https://t.co/n8Mzc63g7R",Roseville_Girl
3356,905539159216893952,Ok I feel so connected to Johnny @JohnnyGWeir because we both have sun (not rain) seasonal depression and we're both cancers ♋️ 😈,cas_pertheghost
3357,811760420662874112,Condoms won't protect you from the crippling depression that hits when you realize meaningless sex won't fill the void inside you,cornbreadsays
3358,902692117230870528,People should be following me so I can spread my crippling virulent depression to more people,imbrogliostew
3359,902686539670585346,when u wanna be social and hang out w ur friends but ur crippling depression thinks otherwise https://t.co/aDKgHBLKZz,hargitayisbae
3360,905539379061338113,when u accidentally gijinka ur depression and start creating new characters surrounding the design ❔❔❔,aliddolguy
3361,811767707490222080,@ColleenB123 thank you for helping me through my life. My anxiety and depression are really hard to deal with and I just wanted to thank you,downworldgrassi
3362,811768600499462144,There is no excuse for stigma and ignorance - be informed #mentalillness #timetochange #depression via @moodcards https://t.co/pHBNmKOCPk,YourServiceDog
3363,811766293183557632,"I wish I had a strong person to help me get through my depression, someone I can legit talk to and they will listen to me.",yourmajestea_
3364,905541990363799552,"2:10 PM BBT Topic has changed to medications and depression in the LR with Josh, Christmas, Alex, and Paul. Kevin... https://t.co/3MdxAmzRSc",mortystv
3365,811765677107318784,Is it me or wasn't increasing tariffs on imports partly responsible for the Great Depression? https://t.co/NY75KivPGk,DerrickMezaz
3366,811776464609624064,"Oh no my family always called depression, ""being really into hammock-chairs"".",fionasings4u
3367,811775105470709760,love when my anxiety and depression are at an all time high always now 🙃🙃🙃,byeimash
3368,902692383195676673,"Google, NAMI jointly develop depression, #mentalhealth test for Americans: https://t.co/DjcFAoUvmD #HCAdaily",healthcareasia
3369,811775887913943040,"@BethMooreLPM All that depression, the mistreatment of a sister, mothering handicapped kids, crushing losses, birthed a ministry!",BedaacrsBetty
3370,902685592877662208,"is repeating ""there are people who have felt worse"" in your head a good tactic to deal with depression?",sheikhimaan
3371,811770799820574720,just finished the first episode of black mirror thats enough depression for today,steelj_
3372,903025553690808320,I have depression and learning disabilities,Firegirl5764
3373,902685758691057664,I was quiet on social media for about a week and followers have diagnosed me with depression.,Bow2DJay
3374,811764205179248640,"Maternal #depression is # 1 complication of #childbirth, yet help is hard to get. 1 Mom shares: https://t.co/dfTanYsVNH by @PPDDocumentary",MsLatina
3375,905543710515105792,"Depression? Anxiety? Meditate - A highly effective herbal formula will help you feel better.
Buy it now at: https://t.co/MCjEbPcSbN https://t.co/OgHNL07TtT",healtopwellness
3376,811773561316769798,And boom goes the depression bomb :&gt;,HK_Stain
3377,811774351397765120,Good nightt sleep tight dont let the crippling chronic depression bite,SadBoyRei
3378,811778261684514817,"@jmaxmann 

Wasn't there something after 1928?  Great Depression?",konrad_jeff
3379,905539975718064134,"Tfw research is showing depression as some kind of neurochemical disease. (We can't just ""get over it"")",VillageTaker
3380,811773349022015488,You changed a lot since high school — depression does that🙂 https://t.co/aFEYtAjgNP,sadtireani
3381,811780462893010944,@iancron Chris Traeger from Parks &amp; Rec is totally a 4! Self absorbed and uses physical activity to manage his proneness to depression!,andyherbek
3382,811761106322591748,"Only 6 months ago, I had horrible cystic acne that prevented me from leaving my house &amp; drove me into a deep depression. I'm just... happy!! https://t.co/Rj4XAHd0HZ",verycoolgirllex
3383,811765764189470721,What do you call a hangover after drinking wine ? The GRAPE depression.,fearlessk8
3384,811766606082768902,@ladies4trump @NoirPatriot @MottaLois hopefully they are conquering their depression and they now realize TRUMP is their president,caroakley
3385,811778221691768832,I tend to burn out pretty hard when i get tired. The depression starts to take over and that aint a good thing,Chieftan_SparkZ
3386,905536455518412800,"Tanzanite called ""stone of magic"" It relieves stress and depression. It also said to transmute negativity. 
 https://t.co/s1gwAskhgp. https://t.co/rs6LNDCJ3l",SuzetteJones19
3387,905540649432125440,"Depression isn't just ""being sad"" and can't just be cured by fresh air. Depression is all-consuming. https://t.co/xBSEo9y7HD",CubeIsHorse
3388,811759453947228161,@ClassyNyancat cyanide cyanide I'd say that im dead inside gotta rhyme its the time for expression of post Yuri depression jk its good maybe,brknNostalgia
3389,811765940606160897,Incredible what exercise can do to help depression,WombatGombac
3390,811775789884547072,But young people do get depression — we just need to know the signs. (Via The Mighty ) https://t.co/S4X6LjIHrq,ScaryMommy
3391,905538546806738946,What I've Learned About Managing Anxiety https://t.co/B2nQGZ3S5F #anxiety #depression #mentalhealth #1in4 #pnd #mentalhealth https://t.co/eoZ2LRuXYH,butterflymum83
3392,811767854395785216,Adicionei um vídeo a uma playlist @YouTube https://t.co/QDYt99nKh2 - I Have Crippling Depression,danistv_peppone
3393,905541918528077826,"lucifer and riverdale returns in october
depression, chill for 2 months pls",colonelzemo
3394,905544189005492224,"I dealt w/ the not cool during/after my fight w/ depression and it restored me embracing my crazy, strong foundation of joy.. YOU can too!👊🏼",realscottyriggs
3395,811769047440359426,10 Struggles Every Woman With Prenatal Depression Just Understands https://t.co/SE29AOevzj via @romper,hopeful_mama
3396,902690329530388480,all I did today....is skip school...isn't depression amazing?....I slept...I didn't care to wake up and go to school...I'm messed...,angel_is_dead
3397,902686654628073472,Sometimes the best way to deal with a bout of depression is with a mug of tea and warmed up Chips Ahoy with lil Reese's in them,bronxdanceparty
3398,811777515517788160,"If you're having trouble with Depression right now, feel free to reach out. https://t.co/EnfzRWsaf3",ArtISwear
3399,902686176951328769,"surviving #depression is not accepting the flower is done blooming, but understanding u continue to spread seeds as long as u keep living.",beccapr95
3400,811777149954912256,"Smoot Hawley wasn't just a disaster, it led to the Great Depression! https://t.co/7X9NEoIwa9",Indira_L
3401,902686520037056512,when ur depression mode is on high and u cant even make good jokes about it https://t.co/VwBCOtkzLP,hotdad23
3402,811781120610156544,Nothing like sulking in your sorrows and depression by eating some halo top ice cream👌🏻,ariellesayssz
3403,905541365471121408,"My health teacher: ""depression isnt just being sad when things go wrong, depression is even being sad when everything is going right""",AriannaaMarie
3404,811773682859331588,THE NEW WALLPAPER CURED MY DEPRESSION IM CRYING BECAUSE OF JOULE I LOVE HEEEEEEER,lucislibari
3405,811767908087037952,Charmander crippling depression ft. Chespin trainer mason: https://t.co/oMsnlkHNez via @YouTube,TheRealMudkip01
3406,811766385961529344,"@iljamiskov human aspects: prevent depression, fight anxiety, get fitter",maxim_ux
3407,811764398528135168,"me: in a constant state of depression
me: https://t.co/lSg6P6h0N8",shartboi
3408,905542229300826112,Working with depression,WHATISAPLANET
3409,811769459841044480,"Does stress,depression and anxiety just get worse as I get older? It wasn't like this when I was in high school. I feel like crying alot.",kaijudude
3410,902684837273882624,Deciding to become a parent when you have long term depression is tough. This is my story. https://t.co/wKJVwvjTyu #MentalHealthMatters,mrshsfavthings
3411,811773954159427584,honestly im so glad i still have my depression twitter. i need to remember to post there about shit instead if here or anywhere else,babysharkade
3412,811781106915741696,"I struggled with depression, anger, suicidal attempts, heartbreak, death, EVERYTHING this year! I fought through all of it!",OhItsDeAndrea_
3413,905543369165811712,"Worries me: @NWSNHC was watching DEPRESSION #Katia last night &amp; expected  upgrading it to tropical storm. &lt; 24 hours, it's a #hurricane #MX https://t.co/W4lWi4mQoK",HisGirlHildy
3414,811766015692521472,"wanted to say ""time for another depression nap"" but it is 10pm so i think it is just called a sleep which means i accomplished 0 things 2day",shaaybs
3415,902690442139099136,when u cant even tell ur coach the days you'll be @ practice bc u dont know when the depression's gonna hit and you won't wanna do anything,space_sk3leton
3416,811771505331863552,"good job valerie! look at that, you've thought your way into depression again!",valsmoonlight
3417,811769416555884544,Merry Anxiety and have a Happy New Depression!!! https://t.co/lJ0f7GSaKT,juicyfishtaco
3418,902686575372492801,when you start to dislike people for petty reasons cause of your depression so you have to step back,amirkwoodelf
3419,905539954943635456,"BTW, depression sucks.  Just in case you didn't know. Even worse when combined with Seasonal Affectiveness Disorder.",FlynnMcLean
3420,902691586424926209,Searching 'Depression'? Google Will Now Get You Help  #healthyliving #healthtips https://t.co/PBqtcZW9qq,GreenideHealth
3421,811767937006731266,"TMS Therapy, A Proven Non-Drug Treatment of Depression for Pregnant Women https://t.co/o6J5P9FtCd https://t.co/CqGzP5XtFr",garnerbarro
3422,905536122305970177,The Link Between Sugar And Depression: What You Should Know https://t.co/XC1JV0u5mM,KelanErn
3423,811774740343836672,Depression comix will be updated on Thursdays instead of Friday during the winter break.,depressioncomix
3424,905539107740377088,Goddamn this is some good depression. Vintage 07-08 shit. That walking around campus at 3am in sweatpants listening to the Weakerthans shit.,sinnersorry
3425,905541665263366144,"Researchers discover an early-warning system for depression in social media images

""This points toward a new... https://t.co/gacTLxmvDq",vermontfablab
3426,903023985214062593,"Stop d stigma, depression is sooooo normal like ridiculously common nothin to be ashamed about hunnies https://t.co/2sYKK2MjbN",imogenfalafel
3427,811766829676896256,"You Are Not Alone! (How To deal with Sadness, Depression, Blues, Anxieti... https://t.co/5sLcy6DzPA on @bloglovin",divamakeupqueen
3428,902689847785205760,"Postpartum depression, or PPD, is just one in a group of illnesses than can affect women either during pregnancy... https://t.co/xEcv6wBpWA",OmBabyCenter
3429,905540907772063744,"no! I'm not eavesdropping, mes cherís!! I wasn't listening to ur conversation about depression",phagreus
3430,905543822796439552,How it feels to have Anxiety and depression come back to you at the speed of light. Fuck depression 😒 https://t.co/6rh1NoRI9t,sugarbitscx
3431,902691032407658496,"Publix cornbread is so good it instantly cures depression - HOLY SHIT.  

""it turns all your bad thoughts into good ones!""",OUTRAGED2012
3432,811773477799788544,DEPRESSER OF THE DEPRESSION OF THE DEPRESSED,BasedChuch
3433,905543683000467456,"Why I don't deserve a label of depression *trigger* https://t.co/kzR6pXUi7D
#depression https://t.co/MZKn4kHGeH",iam_1in4
3434,811772148641648640,guess whos crippling depression is causing them to miss school xD,Iovwendy
3435,811773868553535488,"ICYMI: Inside the #Rams Podcast, Ep. 21: End-of-season depression sets in as coaching search rolls on. https://t.co/urqxceQvg1",OCRegSports
3436,811767348864618496,"depression is often the result of over thinking, our minds create problems that initially didn't exist.",DineshK49892517
3437,811774016105185280,"@PndaFlux With my mom's cancer I've been fighting depression, but I've learned life does get better, you need to be around to see it happen.",Flux_cc
3438,902691812586000385,10 Things Men Do That Make Their Depression Worse- #mentalhealth #mentalillness #depression #menshealth #men https://t.co/PHH8g3tH5o,MEHEP4U
3439,811764171419291650,There are many instances in which I believe I can go without my meds... Yeah...regrets happening right now. Depression is a bitch,DKCesia
3440,902691599242506240,Studies Reveal : Saffron Can Cure Moderate to Severe Depression (and anxiety too) - Wellnesscom https://t.co/cjgI0wbM2v,RosemaryManners
3441,905541000793350145,6 Depression Treatments That Can Work Better Than Drugs https://t.co/O6p31UkVeq https://t.co/aN9mobhXCB,TrendingDrugs
3442,905543665900285952,Depression makes it near impossible to do such trivial things. I am DETERMINED to leave the house tomorrow. And wash my hair. 😳😖,whatsthebluess
3443,905540727345745920,"Navigating post partum depression, a story about a rape victim turned superhero is spreading awareness about rape in India",buzz_ebooks
3444,811762931457200129,@JonathanHoenig *In monotone voice* No it did NOT work and the US sank deeper into the Depression.,jcrush84
3445,905539493511516160,i really thought so many people are really good at threading. was going into a mini depression kante...copy&amp;paste.,DidiPlatinum
3446,902685651606188032,How Do You Know If You Have Depression? Hear This Woman Explain How She Found Out. https://t.co/abi0zsiQ3C #shoplocal,CrypticPics
3447,811780218428002304,Note to self: Don't ever let anxiety and depression rule your life like this again o_o,MrsBillieJean21
3448,905540322507280386,Looks like I'll just have to postpone my crippling depression until after work again https://t.co/LJdOhtS1oE,DefundtheLakers
3449,811763927759683584,@AzureDiviner || I don’t know. I think my depression is coming back strong.,immoralsapphire
3450,902692267999117312,Depression’s “Transcriptional Signatures” Differ in Men vs. Women https://t.co/NEh6S7vPXd,tnjcounselling
3451,903025271816814592,"Commercial: ""if you or a loved one has experienced dry eyes, depression, or even death, contact...""
Me, dead: ""ah yeah I better call in""",SilverKingOtter
3452,905541133056532481,A compliment can reduce depression by 5% in the morning and 15% at unawares. Save a life,Selaballer
3453,905543835366940674,"""Depression is drowning in the water everyone around you is breathing""",JustSomeGurlie
3454,811780455120957440,had a good day today so i convinced myself that my depression isnt real and i just fucked up my life for no reason...anyways im crying again,slowunlikelycat
3455,811776571132366848,@Trashiepie97 happened that it's gone now.That new ''me'' after the exam was by far the happiest I've been before the clinical depression,Trashiepie97
3456,811779136868020224,lmao you're right!! i'd totally fake my depression for likes on twitter!! you're a real detective finding that one out!!!,lxgracexl
3457,902683508551843840,Mental health experts recommend their favorite #depression #books https://t.co/FXxqPWJ7lO #mentalhealth #psychologists #therapists #mood https://t.co/G3tTY1MYTQ,nybhealth
3458,811761456245075968,RT: 7 Ways to Better Understand a Woman’s Postpartum Depression https://t.co/WLG8vb4JQu https://t.co/QhZpXcJNdU,USA_Healthy_
3459,905541633323782144,Being positive is when you have depression; and exert all your heart to fight it in hopes of better days to come,SeroShroom
3460,902689779359387649,"When people think your depression is an aesthetic and you ""rock it well"" but in reality, it's just consuming you from the core until you die",Bluntveld
