,Tweet Id,Text,Username
1022,811658112390328320,I saw Stevie Wonder trending and had a heart attack.,WillBacon12325
1023,811675534295855104,I think I just had a heart attack,babe_jessss
1024,811703418649710592,"To all my students that think Jeopardy is for old people..for $1000, what's the medical term for a heart attack?",caseypaulkATC
1025,811671944487702530,"@ShawnMendesNot oh shit, i thought it was shawn, i had a little heart attack 😂",parkjisungir
1026,811667298679488512,Boyyyy I would have a heart attack!!! I got acid reflux 😂😂😂😂This is basically me trying to kill myself! https://t.co/9Krt4a6z8Y,j_eurai
1027,811686189770088448,I keep playing with my hair and feel that like half of my hair is missing and have a mini heart attack 😂😂,rebeccareamer
1028,811650766335115264,@DvaliciousCandi @johannagriese Really? I must have missed that one. I get it. Better have a heart attack wearing pretty clothes. Reasonable,PiaNys
1029,811652415875416068,i'm gonna have a heart attack at like 25,briebell_
1030,905507513071751169,"Tsunami warnings already in Puerto Rico, I'm deff having a heart attack by the end of the day 😭 #PrayingForPuertoRico",AleimaleeLopez
1031,811663979571453952,"be happy that I didn't give you a heart attack
my brain was late for changing my icon and name to hers https://t.co/19oLdWhjHM",guccixgrande
1032,811688391473504256,@slayingwithsel lmao i know this one person who drank coffee for the first time in their late teens &amp; ended up almost getting a heart attack,lilfilmgirl
1033,811704148051820545,New post: Atkins Diet – Increase Your Heart Attack Risk? https://t.co/Pk4AwqYaMl,gotogetfit
1034,902660779731808257,"Danny Duncan thought he was having a heart attack. Three weeks later, he's still in a coma: https://t.co/UO9jtOPm0m",WTHRcom
1035,905527217962278915,"Of course Julian would be flying home from Florida in the middle of a damn hurricane, currently having a heart attack, no big deal.",L_Green27
1036,811668000130662400,@Ms_HeartAttack i need another dog.. so many reasons why,mariss
1037,811662792797212672,@CAshitanshu1989 @rahulkanwal it took  mnt wn I realised wich rahul r u talkng bout. Lols. I nearly had heart attack ki Ye pappu ko kya hua,chitrarit
1038,811671660365385728,update: the boy started talking to me &amp; I saw a car that looked just like prince and I damn died of a heart attack I ain't bold enough yet,tierraa_vianshe
1039,811657798366990337,top 10 anime deaths: me having a heart attack while waiting for yoi ep 12 to drop,serenerserener
1040,811672995089371136,@huffpostqueer that's so dangerous- I wouldn't even let him wash my horse- his insurance company must be having a heart attack.,authenticpaint
1041,811681417964896256,"As someone said, Trump is the heart attack we needed to make us wake up to just what we've been doing to the world. https://t.co/45l7H4QxJW",Bf99Floyd
1042,811703136914206720,"@RKHTV I quit 2 months and 17 days ago after a heart attack, I've been smoking tobacco for 21 years and I just gave my brother my eGo AIO",GalamothTheOne
1043,811678540953481220,@WutTheDeuce1 @Ms_HeartAttack wow thanks it means alot,eema_f
1044,811689223124348932,Health: HIV May Double Odds of Heart Attack - HIV May Double Odds of Heart Attack https://t.co/XUgFYHeKGe,DrCsHealthBlurb
1045,811645592187310080,I'm going to have a fucking heart attack 😂 @chadmontgomery_ https://t.co/88YDyDS1Y7,ctemp22
1046,905531467668873216,"Keeping tabs on my loved ones in Florida. First, was having a heart attack about my loved ones in Texas, now it's Florida. Prayers going up.",Dawnyy_M
1047,811685839340191745,@GaryBarlow OMG! Heart Attack! Hope to See u all soon in Germany again.😍 xoxo,katharina_s_97
1048,811681697280495617,News Update: HIV May Double Odds of Heart Attack - Study suggests that tools used to predict risk need tweaking... https://t.co/1rhSQLKZU9,mentalwellmru
1049,811685496007102465,via @WebMD #Health- HIV May Double Odds of Heart Attack https://t.co/fAtLYQQwNk,ihealthbuzz
1050,905531654332194817,Almost had a heart attack when I thought I lost the bracelet Ana gave me.,SweetSpicyBacon
1051,811666325319876608,"I saw Sinbad trending,

&amp; damn near had a heart attack. 

90s kid 5ever",thekaimiller
1052,811659631206473728,Most healthiest food that can lower cholesterol blood pressure and prevents heart attack - dates... https://t.co/zr5o8xdj7p,livehealthylif1
1053,811657366219399169,watching prog abt education for disabled folk. Think my young cousin may be on. She lost her sight after a heart attack as a teen,shomac28
1054,905535566736961536,"Heather Heyer died of a Heart Attack, Charolettesville, Retractions NOW https://t.co/iHlMmsFMLv via @YouTube",protakill
1055,811647043093561345,@Ms_HeartAttack just wanted to know my daughter watches you and you have inspired her to game more keep up the work,jokertherogue
1056,902689931180552192,I liked a @YouTube video https://t.co/jXk2o74U7i WARNING: you may get HEART ATTACK from LAUGHTER - Best FUNNY FAIL &amp; ANIMAL VIDEOS,tim_atheist_83
1057,811647202258984961,Cause lord knows I was boutta have a heart attack,LikkleBITCH_
1058,905539914934231040,"Normani , probably there is no chance of you view this tweet, but I would have a heart attack if you surprised me with a follow",harryflowes
1059,905521139702800384,"A caterpillar fell on my coworker and he didn't feel it until someone pointed it out.

I had a heart attack for him 😭😭 wth",LoveDami_
1060,811663396697477121,@Ms_HeartAttack lol yeaaaa not my proudest moment but then again I was so comfy I don't regret it,TheeFenetix
1061,905513084126670848,#TheQueenMzansi Petronella and Gracious should NOT cross paths. The exchange between them would give me a heart attack. 😂😂😂,thapelo_moshia
1062,902684310938857473,Ever wanna know what a heart attack feels like? Clutch 1v5 after slamming energy drinks in @Rainbow6Game,SkamOneFCE
1063,811655748023414784,@LL_MarcyMarc all I can keep thinking about it at Costco 😫😂she was bouta have a heart attack and I was praying not to have to beat ass sick😂,Jahla1017
1064,902692277683924993,My granny just now noticing I had a tattoo and almost had a heart attack 😭🙄,Drriaaa
1065,811672960406687744,@SydneyItalia I'm hearing it was a heart attack,alec_pena1997
1066,902665222611247104,I saw some white chocolate M&amp;Ms in the store and had a mini heart attack 😍,theyloveN_
1067,811683422053736449,"Laughter relieves anger, tension and hostility by over 80% and cuts heart attack risk by over 70%.”",yethiddenfacts
1068,902679028607270912,LRT that poor guy. I would've had a heart attack by now,vatititech
1069,811668359288913920,"LOOK AT ALL THESE FUCKING ALLIGATORS. 
I had a heart attack https://t.co/Np4bvUKwIm",therealwavybaby
1070,902681569957163009,Saw what my checking looking like this week and almost had a heart attack 😂,_successmade
1071,811646105519734784,@jormelfel i literally almost sent my shittalking text to the person once bc i was spacing out i almost had a heart attack,ilovelusi
1072,811647661984141312,#NowPlaying Heart Attack by Demi Lovato on #Anghami https://t.co/Bt2nWG2sZo,RymMire
1073,811671301706416128,When your dumbass thought Justin and John were in boston so you had a mini heart attack til u realize Boston Market is a fast food joint😂😂😭 https://t.co/W5pSTOPAVb,LuvBiebersMusic
1074,811661972852928512,@Ms_HeartAttack just a little something to make you feel better💕 https://t.co/UkDveM0WWk,eema_f
1075,905513026144653312,I had a mini heart attack I thought I tweeted on the wrong account kskdfkkddmd,Zeblahh
1076,902655372372168706,I literally have a heart attack when my sister drives,mergaliciouss
1077,905541824625901568,When fakes harry styles accounts try to follow you and get you a heart attack but the real harry already follows you. https://t.co/zORdpTPX4N,ultimatyong
1078,811683696822652928,When art gives you a heart attack #chylerleigh https://t.co/1NU0RAoOZE,lilmistrouble
1079,811664632054157313,Woodlands drivers give me a damn heart attack.,hanabekiri
1080,902676329400868864,Killgore asked what I was doing for my birthday tomorrow and I said getting my belly button pierced and I thought she had a heart attack 😂,maddy_vaughan
1081,811688126682984448,@Ashl3ighCarey @tvseriesfinale AT FIRST I'VE JUST SEEN 'RENEWED' AND THIS ALMOST GAVE ME A HEART ATTACK JFC,21bartoszk37
1082,902677918815485952,Anti-inflammatory drug 'cuts heart attack risk' https://t.co/O6V36PLJsr,drchrisstout
1083,811647814287691776,THANK YOU FOR GIVING ME A HEART ATTACK #MercyAcousticVideo @ShawnMendes,shawnslilnugs
1084,811674374835081216,"@cecilyrve …living room &amp; she almost had a heart attack. i swear. she was like ""AI. THEY'RE SHOWING THEIR PENIS."" even thou the scene…",cecilyrve
1085,905525128137670657,Metroid Samus Returns is out next week I'm having a heart attack.,david__masson
1086,811700636014280704,AHL player recovering from on-ice heart attack - https://t.co/hKkCfSM5Fy,OnfreNealon
1087,902673993462833152,i said alex jones should have his overdue heart attack already and twitter said : https://t.co/8zFUbnzdZZ,DrumpfsLies
1088,903025464679309312,I'm doing a new thing everyday I don't have a heart attack I'm gonna count it/ today is day 1,Indigoali33
1089,811666810613460993,Scientists say eating red meat DOESN’T increase your risk of heart attack https://t.co/la896MZ17a https://t.co/c6NBDeXlnt,TheSun
1090,811661919740305408,Y'all I almost had a heart attack. She's watching a make up tutorial!!! https://t.co/yXDE3pR6D4,BAULAPARRANTES
1091,811702035116675072,Stressing gonna fuck around and give me a heart attack,BR00KYLN_B0RN
1092,811677800381808640,wtf I almost had a heart attack watching this https://t.co/TXQcNXlAst,JTriumf
1093,902682632907091970,"Anti-inflammatory drug canakinumab lowers heart attack risks, study shows - CBS News https://t.co/WOQfXZZz9F",mymigrainedoc
1094,811668075087101953,@ShawnMendesNot just got a heart attack thank you,Romymlx
1095,811662535690780672,Paramedic who stood by as man died of heart attack at Walsall Manor Hospital faces new job threat https://t.co/qkJ8sgG14U https://t.co/eSUi8hvyBo,ExpressandStar
1096,811657746164551681,Dr. @simonjjones developed methodology for study finding that heart attack rate is down significantly in Ireland https://t.co/iBJAtnX7NE,pophealthNYC
1097,811667037995016192,Literally almost had a heart attack today because I lost my promise ring for about an hour,livjoynutrition
1098,902680335992979457,#didyouknow we can test bacteria levels in your saliva and see if you are at risk of a HEART ATTACK!... https://t.co/W2YDnDKcQU,drtraceynguyen
1099,811656954426884096,"@ShawnMendes  Please have mercy of min during that week your anticipated gifts almost made me have a heart attack
#MercyAcousticVideo",LeticiaMachado9
1100,811650602144935937,こんな夜中に見返したら面白すぎてwwww 업텐션(UP10TION) Fan Heart Attack Idol TV https://t.co/WxuDCizp06,aou10t
1101,811654869270626304,My alarm just gave me a heart attack,blexxican__
1102,811650747926462464,I would have made her old ass have a heart attack https://t.co/yzmAeGPuTo,droptopzones
1103,811649331929481216,"@ErinB_DBD @merrinish ah yes, the terminal A to E dash.  I am destined to have a heart attack somewhere around C terminal.",gil_brice
1104,902683141994885120,"#Policy4Health In a first, anti-inflammatory drug lowers heart attack risks https://t.co/B6eUfkLiYT",Policy4Health
1105,811644183937159168,"Had a sleep as I went for 24hrs with no sleep. Esophogus is sore. But yeah, it gives you the charming symptoms of a heart attack.",savourydeets
1106,811671881216626688,#skynet #ai HIV patients have nearly twice the heart attack risk https://t.co/jpXtOyyHgo,skynet_io
1107,811693878780645376,HIV May Double Odds of Heart Attack - WebMD: https://t.co/KaPcN08svR HIV May Double Odds of Heart… https://t.co/lLH2sDD3cX #STD #HIV #AIDS,positivesdates
1108,811664332803031040,"35 year young men died in bank queue, due to heart attack Anupshahr, because he was sick and recent lost his job. https://t.co/MdsNkeP4MF",AAPkaNews
1109,905510275478163457,Countdown is a great song. But have y'all ever had it set as your alarm? Heart attack every morning,serene_oddity
1110,905543875456065536,omgggg so true I have a literal heart attack every time it comes on 😕😭 https://t.co/CXvNC7lg20,louisejadesmith
1111,902657384069390336,Did you know that cholesterol testing identifies only 40% of those at risk for #heartdisease? https://t.co/BEJ6hmUIne,LifeExtension
1112,811645149159661568,"@MMFlint Everyone to blame except your sorry-ass candidate. Get over this,  b4 you have that inevitable heart attack.",MikeWolf1980
1113,811687964891705344,High pain tolerance may mask heart attack symptoms https://t.co/DhSkbntjlK,SocialNurseWeb
1114,811686851308158976,"god now i can finally see what yuri meant by ""let's end this""
im gonna have a heart attack",strawberrypng
1115,902684375497805824,i love bunnies sooo much idk if i could have one tho a lot of noise can make it have a heart attack,okiuras
1116,811660493400276993,"I had a little heart attack, I'm laughing 😂😂 https://t.co/Sk3ydWq9r2",xcxsaturno
1117,811648794546814976,@AmazingPhil Omg I bet you had a mini heart attack..,HelenaDimic
1118,902665334712389632,"Ran off the road on my way to work , and probably has a mini heart attack",alexisjl09
1119,902662199847645184,"In a first, anti-inflammatory drug lowers heart attack risks - CBS News https://t.co/NKDkLYGWOF",Tribune_Health
1120,905541199615979520,i miss when mcdonalds sold that heart attack in a box for only $10.. that shit had so much food 😂,ronnietsunamii
1121,811651399964622849,@Ms_HeartAttack This is me when I play Destiny with my friends. https://t.co/LDO65ZzMN6,narutoboy45
1122,811683224393023488,Matt damon yeni filmi geliyor ay mini heart attack ben! Platonik aşk yaşıyor olabilirim adama sanırım daha önce de belirttim.,lopetifonje
1123,905520094666661888,It's like his ass woke up one day and was like hey thats angelicas favorite hair color on me i hope she has a heart attack when she sees https://t.co/wZb9SCZpq2,ragtag103114
1124,905541510975950848,Morwell residents seven times more likely to have heart attack since Hazelwood fire https://t.co/k9MS9ibmZI via @ABCNews,healthyenergyi
1125,811703856723857409,Sanson says his Universo 2000 is doing fine now after his heart attack. Doctors advised him to drop 25 kgs in weight to benefit his health.,MicromanFever
1126,811662301849931776,Just drove through Helena for the second time in almost 2 years. Felt like I was going to have a heart attack. Still so hard.,khchilders
1127,811663753796263936,"I wanna watch the Yuri on Ice finale, but I also wanna wait until Isa has watched it and she can spoiler me, so I don't have a heart attack.",fairytalelights
1128,902689271773102080,one day I will actually have a heart attack and sue you BigHit https://t.co/aAPj7nyknH,pyjamays
1129,811676026065604608,white monster mixed with a scoop and a half of mr hyde. If I have a heart attack someone tell my parents that I at least got a good ass pump,BrendanBarnz
1130,902692149078130688,BBC News - Anti-inflammatory drug 'cuts heart attack risk' https://t.co/JIMKg8PL0O,JulieAMalone
1131,905539319095582720,I j had a heart attack watching the trailer so no thanks https://t.co/iuhCGQYyVw,sthomp_
1132,811680221904732160,HIV May Double Odds of Heart Attack https://t.co/BjKzw1gWDz,beautycrib_tv
1133,811692742451478529,Slideshow: A Visual Guide to a Heart Attack https://t.co/NdAB5n46Qo,visionaryhcs
1134,811646249350926336,He gets a mini heart attack when he sees the credit card statement 🙃 💳 😱,mina_yazzy_
1135,902685205089091584,"Call an ambulance because I had a mini heart attack at the ""kissing-WOOPS!-it's-actually-a-hug"" thing https://t.co/DwGz63cyYu",victoria_ide
1136,811656499349045248,im going to have a heart attack @girlalmighty FLEETWOOD MAC https://t.co/SoJDdqkhsY,sikenpoem
1137,811650275857416192,2. Don't drive right next to my car!!! I don't need you having a heart attack and crashing into me. Punk ass,cuddletimekitty
1138,902686067899469824,"A suspected drug trafficker, a farmer from Champasak in Laos, dies of a heart attack in prison awaiting trial. https://t.co/Lv69MNvjyS",KhmerTimes
1139,811662451116769285,"@PaveDarker @Hoodwink71 I dont deny his right to speak whatever langauage he wants, Doesent mean give people a heart attack on a plane. Sad!",realRobertKush
1140,811688148367527936,MY CHRISTMAS PRESENT FOR MY DAD CAME IN ITS OWN PACKAGE NOT IN A PLAIN BROWN AMAZON BOX AND I HAD A HEART ATTACK BECAUSE WHAT IF HE SAW,hicallista
1141,811655271554707457,"@Stefannnnnnn @RockstarGames Lmao, I gotta say I got a mini heart attack, played on this account since release :D",ohbrox
1142,811661463941042176,"@janephilpott VERY interesting. Depression usually follows a heart attack. ""Talk therapy"" sounds like an effective possibility 4 dealing w/. https://t.co/Ko1YRRcsZO",5678cloverdale
1143,811683544091230209,911 THIS IS AN EMERGENVY IM HAVING A HEART ATTACK AND ITS ALL YURI ON ICE'S FAULT,thneedinc
1144,811677718966321154,Craig Cunningham's recovery after a November 19th on-ice heart attack has been dubbed a 'Christmas miracle'. https://t.co/XAISGRj8L2,KamloopsBCNow
1145,811688146517786628,@troubleontherun I think I had a heart attack just looking at that. And also saw my laundry bill go up. I'd have that all over me.,jaystancil
1146,811681854508015616,"HIV May Double Odds of Heart Attack -  https://t.co/nUqGvXrKT5
HIV May Double Odds of Heart Attack
Original Article https://t.co/kBxjTp6SMe",d4doctor4u
1147,905542095506722816,"I read that as Katie then and nearly had a heart attack, there's no vacancies in my womb nOPE https://t.co/unQ0V5tepM",wuffbertt
1148,811682212189970433,HIV patients have nearly twice the heart attack risk - Northwestern Now https://t.co/zewCgFItWz,GerardHough
1149,811663683025829888,"@LisaCim @KATVONDbeauty  Noo, what the heck, it should be a crime to be as beautiful as you. You could end up giving someone a heartattack&lt;3",WorthTheFightDK
1150,905510279802265600,Don't ask me how much I think I spend on food &amp; alcohol bc I will charge you with attempted murder- tryna give me a damn heart attack!,slzrga
1151,811655591139676161,would have a heart attack...once you get the kids..you would have them for life...,billyliar9
1152,811653091019935744,RT @Quotes  Half of Americans will have a heart attack. ➡https://t.co/LbQV9dZBFf https://t.co/eWSw0KDY5A #health,yourbookzone
1153,811688731853914112,"@dick_nixon I read somewhere that, actuarially speaking, Trump was 7x as likely to have a heart attack as Hillary over the next 4 years.",numbakrunch
1154,811681451674664960,@jswanged i wait for the day you post a selca so i can have a heart attack and tell you how beautiful you are,jiminskooks
1155,811672655053066240,HIV patients have nearly twice the heart attack risk - Current methods to predict the risk of heart attack and stroke vastly underestimate …,SFTicketsPlus
1156,905539328692019202,"For those who don't know my mother was in the Hospital for a Heart Attack she had Monday.

She is home. .3.",ValorB
1157,905514104894484481,Ima smack the grocery manager who was telling everyone in the store QA was there jfc that was a heart attack I didnt need,Aurablade296
1158,811664938880135168,.@MIABOARDMAN you look incredible! But Manley may have a heart attack if he sees you trying on wedding dresses #DontTellTheGroom #TeenMomUK https://t.co/V0P4fTeV4u,MTVTeenMomUK
1159,811661107593035776,"@Ms_HeartAttack lol you wake up look at the time and the 1st thing you say is""daaaaa fuuuuck"" 😂",LoTecHinHD
1160,905544008029622273,This Saturday makes one year since my mom suffered a heart attack and stroke. I think about it everyday. Thank u again to the friends that,DabzyDaisy
1161,811671151478968320,Glad to hear that Whatsapp are trialing an Unsend button. I'll finally be able to unsend the sext that caused my Nan's heart attack in 2011,Michael1979
1162,811665014377455616,@Travisj760 a heart attack that ends in death? A girl can dream,sfierro_
1163,811680174911721472,@Discovery films a dude having a heart attack. Smh 🤦🏾‍♂️,ProudVeteran619
1164,905507310973407232,HOLY FUCK GABRIELLE IS THAT YOU?! @TheGabbieShow LEGIT ONE VERSE IN AND ALREADY HAD A HEART ATTACK #OutLoud https://t.co/CZNujCPhgd,itsdreamcat
1165,905536712809611267,I'm the confetti stopping him from giving me another heart attack https://t.co/wL1rqtsfQ5,failuremp3
1166,811681761872773120,"@wmata Tell your train operators to learn how to operate trains first.and stop doing stop and go driving, giving all passengers heart attack",truthcentrasia
1167,905523424612765696,I know service vehicles gotta be somewhere but honking at me literally gives me a heart attack,hellaliterate
1168,811659446661287936,Nhs well done Kettering hospital saved my freind Neil having heart attack early hours Sunday morning tuvmuch,unitedgirl566
1169,811681243414851585,HIV May Double Odds of Heart Attack: “When people have higher risks of heart attack or… https://t.co/kt67d3VJ6H,beautycrib_tv
1170,811647909292863488,Just found out that my mum had a routine ECG and the results showed she's either had a heart attack sometime recently or has got possible...,Cheekyswinematt
1171,811675428003819520,"#Nauru refugee says medical treatment withheld after he had heart attack
https://t.co/yQCQMqCd7u via @guardian #auspol #medicalneglect",jouljet
1172,902671673496920065,I just had a moment where I completely forgot my age. That was a mini existential heart attack alright. I'm not even old.,EDarkness
1173,811668244339761152,MINE ÄRA PSMDOSLSKOSOS I GOT A HEART ATTACK https://t.co/IsIiN2WRkI,joequinn94
1174,811682239708889089,Heart attack recovery update #heartattacksurvivor  https://t.co/U2nx6onKuS,thecivvie
1175,811684666981974018,That dude is gonna have a heart attack when you all... — Alright https://t.co/4jIJq8KpHh,JGsmooth13
1176,811664338255773696,@anactualmess @helioboros https://t.co/BVwqzGs1hb let's get in here and NOT give my crunchyroll account a heart attack,trimmau
1177,811686615114534913,When Vividha got some serious issue to discuss with Atharv. 🙄😭 When she almost gave him a heart attack. 😱#ViTharv #JNDSD https://t.co/fBDgxVLRci,IZaineb
1178,811656332088590336,James Fixx the man who popularized jogging in America died of a heart attack while running. R.I.P #fact,RaymondBrown__
1179,905509490732048384,Pomegranate juice can prevent a heart attack.,factttsss
1180,811676172165742592,"@fairlyliterary @TitoTitoq85 I need your twitter handle not to give me a minor heart attack, Rabia! Almost thought I saw hung like a boss 😱",geekazon
1181,905513719991377920,So happy that I get to learn all about hearts so that I know when I'm actually having a heart attack this year,_Hannah_Sim
1182,811646305848201217,@tinygifs His smile would be the reason If I got  a heart attack some day ❤😍 Gawd he is so beautiful 😍❤😍❤😍❤😍❤,umakhatri_
1183,811675945870434304,@RomanAtwood pls dont start he click bate nonsense.we love you and watch your vlogs without having to have a heart attack when we see title😕,PoisonSpits
1184,905526890819149825,"Thanks recruiter person, almost had a heart attack thinking that all my react native work that’s in private repos went public... https://t.co/kviDRvemNT",vincentriemer
1185,902683065260007424,I could probably be in the middle of a heart attack and not feel a,_lilnorma
1186,811702365581549569,High Pain Tolerance Tied to 'Silent' Heart Attack Risk. https://t.co/zWYkL1kKMF,norway
1187,902674782013018114,first i thought that is an one direction pic and i had a little heart attack. https://t.co/SQqknhrn3w,perrizers
1188,811660058329280512,@Ms_HeartAttack if it makes you feel better yesterday I woke up at 9am and stayed in bed watching the office until like 3pm lol,TheeFenetix
1189,811685864824836097,@Salmaan_p I got one for that too alhamdulillah I survived that heart attack I don't even use itunes 😂 but the amazon one I shat myself fml😭,bengalitrash
1190,811644820640894977,@assahton5sos U FUCKING SCARED ME HDJSJSBDKAO I LITERALLY HAD A HEART ATTACK AND NOW IM CRYING CAUSE HE DIDNT FOLLOW ME,smhhoodd
1191,902662460548767744,This song actually made me cry 😞it expressed how I felt when I got the news my mum had a heart attack! I feared the worst not being able to https://t.co/2hLBk33vvO,SheGamerxo
1192,811684103657492480,"""I could be having a heart attack and you'd just tell me it's fine it happens sometimes when people look at you""",txshadxwns_
1193,902667197561970690,An Australian study has found the rate of healthy patients having heart attacks has gone up from 11 percent to 27... https://t.co/IZNK2V7AeQ,LWCHC
1194,902673683461816320,"oh just go away and have your heart attack already, you fat fuck. @RealAlexJones #MAGA https://t.co/dIacgfsYil",DrumpfsLies
1195,903025467518832643,"Only just watched Annabelle Creation, my god almost had a heart attack",amarjhot
1196,811666861838372864,"Just not feeling Christmas this year. Still have post heart attack depression, which is normal.",doodsterpdx
1197,811673914011189248,HIV patients have nearly twice the heart attack risk  https://t.co/xaOBD4rACo #science #health,jennbeightol
1198,811644742148702208,A linesman's whistle induced heart attack and some nice videos feature in @FourFourCou's match review https://t.co/kqWw7tAOFc,AnfieldEdition
1199,902679110585126917,"Marriage a Blessing for Heart Attack Patients | TUESDAY, Aug. 29, 2017 (HealthDay News) - Marriage is ... | https://t.co/hEurSt8UW4",Rocketnews1
1200,811694363134881792,"What is happening this is the 3rd friend in 3 weeks that has either Had a heart attack,seizure or died. These... https://t.co/KSsaIs1N4U",sawstrunk
1201,902665592611667973,Wish my mum wouldn't force my door open fast when it's 11:53pm gives me a heart attack thinking someone is trying to break in,paigeaprilll
