,Tweet Id,Text,Username
2074,813104577595801601,Scientists are unearthing the epigenetic changes which lead to Parkinson's Disease. Watch the full video: https://t.co/J9ZFrKQdzF https://t.co/Uj14IUxK3W,SelectScience
2075,813104720931852288,Empowering researchers with @IBMWatson to find a treatment for Parkinson's ► https://t.co/LEB4TLySuM,TechPORTFOLIO
2076,902680923329531904,FDA refuses Acorda NDA for Parkinson's drug candidate because of manufacturing issues - FiercePharma https://t.co/qo2jXnfuft,Manufacturing24
2077,813165595432747009,George Michael - A Different Corner (Live On BBC Parkinson Show) https://t.co/joaBmsy8G7 via @YouTube   RIP#georgemichael,astrid_janse
2078,905592272565280768,"Veteran TV journalist Peter Luck has died from Parkinson's aged 73. #9News
https://t.co/wZrrMyJMmR",9NewsAUS
2079,812529496557580288,How I Learned to Walk with Parkinson's  https://t.co/SZngYEZAyS #movementdisorders,DrGarySharpe
2080,905606318173544448,Dementia news: Alzheimer's and Parkinson's sufferers have more of… https://t.co/ppiY1pw1Dm https://t.co/PvYEP4NoYR https://t.co/PvYEP4NoYR,anniemsullivan
2081,812551203653435392,@McFaul Nobody cares about #NastyHillary. She'll swing from a noose after her treason trial if the Parkinson's doesn't get her first.,Trump_Landslide
2082,813205494055702528,Karl's version of Parkinson's Law: Work expands to exceed the time allotted it.,BecauseImMom
2083,902620217444065288,"Cancer Drug That Might Slow Parkinson's, Alzheimer's Headed For Bigger Tests https://t.co/1rCxaMO96Q #alz,#caregiver",DrIreneRodway
2084,813069645079072768,Good dog! K-9 credited for finding missing hunter with Parkinson's disease #DogBehavior #DogSenseUK https://t.co/rHR45mSH3u,dogsenseuk
2085,813024010468474880,My Niume Creative Writing Challenge for Out-Thinking Parkinson's  https://t.co/xSgbJLxS7M #contentmarketing,DrGarySharpe
2086,813094468719099904,Please come and join the BIG Parkinson's Disease Discussion  https://t.co/bucHEazHZb #parkinsonsdisease,DrGarySharpe
2087,903007763642683395,Unraveling Health Disparities for Women with Parkinson's Disease https://t.co/nnd9BGXgrF via @ReachMD,MleeGrp
2088,812950608068100096,@Jamesy_boy @tim_parkinson I'm having a cup of tea first but that sounds ideal.,andyh2o
2089,902652847048859648,"When You Buy our shirts 50% goes to ""The Michael J. Fox Foundation For Parkinson's Research""...Improving Therapies… https://t.co/iVz1La2xY2 https://t.co/sGQgntkpST",UltraErosCobra
2090,905778935677505538,"RIGHT NOW

Michael Parkinson from @PreventingCrime joins @JennCampbell77 to chat about opioid deaths in our region 

https://t.co/32iCafEJp9 https://t.co/gkjMoi7oel",CityNewsKIT
2091,812679366723379200,Please consider helping me raise money for a special utensil for my uncle with Parkinson's or sharing this link!! https://t.co/iZmbedWYt3,imsuchakilljoy
2092,812582661961170944,Never underrate sherry @waitrose https://t.co/v0nP7C0vNl Great choice by @jane_parkinson on #SaturdayKitchen hosted by @JohnTorode1 https://t.co/GdwjGfI84c,csljohnkirby
2093,812716575232929792,#healthcare in Canada as it is! B.C. family battles government to get #Parkinson’s drug covered https://t.co/lVNSXqxY5q,ThisBoyTV
2094,905829492790198273,"17 years with Parkinson's, David Hollister still puts up a fight https://t.co/s6O9JpgU9u",LSJNews
2095,812969273199042560,Parkinson's specific exercise class launch - 16/12/2016 https://t.co/uy1Mkphm5E,MedwayPdWAG
2096,812572479910801408,shit said i had Parkinson's disease 😭😭😭 i closed my safari out so damn fast,1luvsbl
2097,812726610344427520,Trial suggests Parkinson's disease can be treated with ultrasound waves | The Columbus Dispatch https://t.co/X6Mg38mXYl via @DispatchAlerts,JoAnneViviano
2098,902624937252454400,support parkinson's disease and hmu to buy a shirt for $10 they will be worn september 8th at the crittenden county football game https://t.co/l1EE15qScf,DarnellMakayla
2099,812667065957949441,Exercise May Be Real Medicine for Parkinson's Disease: Title: Exercise May Be Real Medicine for Parkinson's Disease… https://t.co/r1DyW7NTnF https://t.co/F9xyhfuH1V,WellnessInitiat
2100,812981720706232324,Wishing everyone happy holidays from 100 For #Parkinson's. Thank you for a fantastic 2016!! https://t.co/shUf316PUi,100Parkinsons
2101,902613303180058628,"Living with Parkinson's can be challenging, but there's things you can do to feel more in control. What helps you? https://t.co/mYvcBrVb7f https://t.co/mnwjEdIcOH",ParkinsonsUK
2102,812992352310726656,Thanks for the follow Christine Parkinson!,Philobendorf
2103,812645481180495872,"Researchers make advance in possible treatments for Gaucher, Parkinson’s diseases https://t.co/NqAuOFaumt",msrc_ju
2104,905823476073750529,"Parkinson’s Severity Assessed Through Drawing https://t.co/suXU1fJyeu vía @NeuroscienceNew 
#Parkinson",enfermedadPSP
2105,812681747523653632,Curiosity and Play Therapy for Parkinson's  https://t.co/weiVbzbcJl #curiosity,DrGarySharpe
2106,812690651716472834,"Michael J. Fox Nails Soulful Guitar Solo, Playing With Dave Matthews For Parkinson's Research... https://t.co/VZs7237spI",MHA
2107,902615347949338624,A New Direction for the Treatment of Parkinson's Disease https://t.co/laof6NaWy3 #parkinsons,DrGarySharpe
2108,812828800685867008,My grandpa had Parkinson's and had a lot of trouble walking and standing up straight. He died two months ago and my gma still has these❤️ https://t.co/Xyl7506z14,AshChilds1
2109,813038085013442560,BBC News - Study links Parkinson's disease to industrial solvent https://t.co/WAgombRPWb,zapher134
2110,905529076408094720,Spiral drawing test detects signs of Parkinson's #Parkinsons #drawing  https://t.co/xOrYjK8BTO,HCEUK
2111,905597276927787009,Medical News Today: Antidepressants could delay Parkinson's progression https://t.co/lTdJGB69TA #health,FareedRiyazMD
2112,905525744062705664,Researchers combined measurements of drawing speed and pen pressure to diagnose #Parkinson’s disease severity. https://t.co/B4K15f3Ff1 https://t.co/EjMRZJicHV,MichaelNawa
2113,812591735310315520,Wearable device helps steady hand of designer who has Parkinson’s disease https://t.co/aDx0Z7UN8n,fjolivares
2114,812950112959889408,PD Warrior Parkinson's trial in Newport is Wales' first #Wales https://t.co/qGrKP8BoNl,Wales_News_
2115,812869327800111104,"@random_eddie @d08890 ""This decree seems to have been enforced ever since""---C. N. Parkinson",jhertzli
2116,812581592166240256,Delightful Nicosia Etna Rosso 2014 https://t.co/oC8R4r3hsK from @marksandspencer picked by @jane_parkinson on #SaturdayKitchen @JohnTorode1 https://t.co/l0vsb71Z1H,csljohnkirby
2117,813173187013988352,Work expands so as to fill the time available for its completion. Cyril Northcote Parkinson/Parkinson's Law.,BrazilNewsinUK
2118,813163693240451072,"George Michael - A Different Corner (Live On BBC Parkinson Show) I love this song. RIP, what a talent.  https://t.co/w9scSkBqam",afcPat415
2119,902650991249694720,I'm fundraising for Parkinson’s UK. Donate to Douglas's JustGiving page  https://t.co/tLwpQfXjhq,djross_21
2120,812832821622476800,"#Depression update 2016: #Parkinson’s disease, #heart disease risk, heart failure patients, #yoga https://t.co/vJhgq8wr7I",BelMarra
2121,813120438700277760,The link between the gut microbiome and Parkinson's disease etiopathogenesis @CellCellPress #microbiome #Parkinsons https://t.co/rWBtYLrBUv,MichaelCaudle1
2122,812924610232680448,RT @OutThinkingPD The Art of Symptom and Side-Effect Control in Parkinson's  https://t.co/9QeIH9ZRzN,PaulCroubalian
2123,903007674094280704,"For the first time, stem cells from adults rather than embryos have relieved Parkinson’s symptoms in monkeys. https://t.co/MgFACflbIT",HHMINEWS
2124,903001387755331586,"The Overlaps Between Stress and Parkinson's Disease, Part 2 https://t.co/nIalOCn36B #blogger",DrGarySharpe
2125,812874331273445377,Remember the role of dopamine in Parkinson's versus Schizophrenia #bcpsexam #pharmacy #pharmacist,Mededucation101
2126,813208489317335040,George Michael - A Different Corner (Live On BBC Parkinson Show) https://t.co/Xy6Lwp6zNT via @YouTube,KeithEwell2nyc
2127,902709217768955906,FDA approves new drug for those with Parkinson's who are experiencing dyskinesia. Small steps but in a great... https://t.co/Exy5lCX0yx,Medicaljobsplus
2128,812677339465121793,"England Sends Its Banned Weed Killer Paraquat to U.S, Where Demand is high in Spite of Parkinson’s  https://t.co/qjOfuvED4w",emortal_the
2129,813166188113051651,RT @OutThinkingPD Blue Glasses and Parkinson's Disease  https://t.co/zvcOZJxs1Z,PaulCroubalian
2130,813185055602409476,George Michael - A Different Corner (Live On BBC Parkinson Show)  means a lot to me 💔 https://t.co/p8jlmWfRJb,gillypants
2131,813021489830109185,"New research shows how a diabetes drug can combat Parkinson's
https://t.co/b6vYXMpGK8",digitaljournal
2132,812732398232358912,"The Noodles that Cause Chronic Inflammation, Weight Gain, Alzheimer’s and Parkinson’s disease https://t.co/E4R912N78g",BurnetBurnett
2133,905775164570337280,Accessing Whole Body Movement in Parkinson's Disease with a Basketball https://t.co/BaKCkmzNSV #wellbeing,DrGarySharpe
2134,812710195537199105,+survives my grandpa who died last yr after a long fight w Parkinson's that ended in dementia so bad he didnt know who i was n made him+,xanthiel_grey
2135,812765071700987904,"In-home caregivers can render huge help and support to our senior adored ones who are experiencing Parkinson's. 
https://t.co/KiweYt7rGm",SMcomfortkeeper
2136,903002760357961728,"Study finds that Parkinson's patients have a higher risk of melanoma, and the opposite is also true https://t.co/COwXR8mDcc https://t.co/bP9pZcORXD",IvanaKorac6
2137,812865822288990208,Ohio State trial suggests Parkinson's disease can be treated with ultrasound waves https://t.co/NIK6LpekVt,MDFCSouthFl
2138,902667255615541248,The New England Parkinson's Ride is right around the corner. Register today! https://t.co/xIYtNoEPyV,ActivityMaine
2139,812863224026570752,The link between Parkinson's disease and gut bacteria : https://t.co/T4tEb7Hxsv,ArticleAuthors
2140,905784731727536128,Pro-Active and Practical Self-Healing of a Person with Parkinson's https://t.co/WcJS1vvVdK #blogger,DrGarySharpe
2141,812780110893973504,The chef's at Parki's Kookatelier present a festive meal with ingredients you can prepare the day before #Parkinsons https://t.co/Clu4GqhNpi https://t.co/LRVI79KSb7,parkinsons_life
2142,812967924755562496,"@scienmag Autonomic nervous system is esential for cardiac function, for instance, in Parkinson's disease",AlinoMartinez
2143,905795926941425664,"Police seek ‘vicious’ robbers who beat man, 82, with Parkinson’s in East Ham https://t.co/sXVQ1A8KEv https://t.co/ta53uHIqYj",NewhamRR
2144,813209358947340288,"Watch ""George Michael - A Different Corner (Live On BBC Parkinson Show)"" on YouTube - https://t.co/aLIMgpv3Y5",TalkinToU
2145,812580941059198976,From @majesticwine Elysium Black Muscat https://t.co/yn9T2TPuVd chosen by @jane_parkinson to go with @JohnTorode1's… https://t.co/es2QVoOkFU,csljohnkirby
2146,903000015404138496,"Parkinson’s law: “Work expands to fill the time available for its completion.” When I was in university, I always... https://t.co/D6uzT25b9H",risingafricaorg
2147,813057982955212800,Role of Lyrics and Song in Parkinson's Disease  https://t.co/FaL26irYYV #popmusic,DrGarySharpe
2148,902669681013784577,"📡 Ep 6 of #EverybodyHurts podcast: ""Suffer On"" w/ Sir Evan Siddall, a Sufferlandrian battling Parkinson's disease. 👉 https://t.co/Lt3r8m7ACr https://t.co/rCbOQZ6Pgb",wahooSYSTM
2149,812735891634614273,Is the cure for Parkinson's already here? Dr. Brundin is investigating a diabetes drug that appears promising https://t.co/IHe8ZdqPDJ,speechvive
2150,905818671456567298,BBC News - Spiral drawing test detects signs of Parkinson's https://t.co/cufYo8S1rP,18AKGOYAL
2151,812943153233887232,1974 Morecambe &amp; Wise appear on “Parkinson” chat show @BBCOne #OnThisDay https://t.co/Hm5ykVDM6x,Iain_McDougall
2152,813071757250854912,@navi226 Thatcher's Old Rascal could be renamed Parkinson's Pils maybe? (I picked up the Ice wine in Lidl!).,IpCollins
2153,812623577254166528,"@JohnTorode1 @SaturdayKitchen @OliasGastronomy @TheoRandall @Charitchie @jane_parkinson and to you John, have a goodun!!",tandoor_i
2154,813062113153273856,"[Clip] Interview The Parkinson , Nap A Lean , Helmetheads https://t.co/1PRgMaqCiH",10775Sunshine
2155,813218271394566145,"Next year, I want medicine to cure Parkinson's disease by one blow https://t.co/HgSFnnnnzn",characteryou1
2156,902724060123095040,That was a quick four years. Seems like Parkinson just took over the IUPUI program.,hoopism
2157,902639006193770498,Overcoming Constipation in Parkinson's Disease https://t.co/LmfopFGUrF #blogger,DrGarySharpe
2158,902675320230354945,"Adamas Pharma says its new Parkinson's drug isn't just a more expensive, long-acting… https://t.co/yngV68sYTb",pharma_global
2159,812801212995272704,Parkinson's doesn't have to be the end of laughter. Vikki has a sense of humor about it. https://t.co/14s9JZ4Bqj https://t.co/0Yo1KzVMpN,KatheKline
2160,812612994345664513,"@SaturdayKitchen @JohnTorode1 @OliasGastronomy @TheoRandall @Charitchie @jane_parkinson bit of Bromance me thinks...
Maybe one sided John...",tandoor_i
2161,812953643402010624,Merry Christmas from the Parkinson's Life team to all our readers in the international #Parkinsons community. Thanks for all your support!!! https://t.co/JHzOhi85Kv,parkinsons_life
2162,903001240577032192,We are delighted to announce that ALL IN by Richard Parkinson is officially now available on all e-devices. https://t.co/ulI6UB7u5F,EDGEpublishing
2163,812606284310740992,"#bestculinarytravelbook
www.rosemaryparkinson 
Barbados Bu'n-Bu'n. Awarded Best Self Published Book in the World 2015. Great Gift. https://t.co/u0ASCDbRI5",rparkinson246
2164,813013422707249153,"Would love to use my dancing to do something like this, esp since fighting Parkinson's means so much to me. Love this 💪🙌 #culturematters https://t.co/lOctjglrS7",PollyClock
2165,812697902103621633,This weeks video: a look at new a new Parkinson's treatment. https://t.co/IybiBEyr5j,doralchenoweth
2166,812937931719577600,"New therapy for Alzheimer’s, Parkinson’s in the offing https://t.co/eGMKLczQFZ #kashmirtelegraph #socialtrends",meetROMEET
2167,902686097418936323,Thanks you Patrik Brundin and Cure Parkinson's Trust! https://t.co/7XNhTA9igh,RyanTripp5
2168,812608128269291520,@parkinson_joe well I've no nasal hair left !!!💩,NicoletteParki1
2169,902723739514785793,Takeda buys into Astrazeneca’s early stage Parkinson’s program - Although it has a long track r https://t.co/dKF9VE9cTB #neuroscience,into_AI
2170,812758143998402560,what is Parkinson's disease? and new method to cure Parkinson's disease.... https://t.co/ejO3MEo20N via @YouTube,EBiology3
2171,902690128186966017,Altered Gut Microbiome Could Indicate Parkinson’s Disease https://t.co/e2q9tg0nuX #BrainNews #Medicine #Health,SummitNeuro
2172,812950355122278401,Katherine Parkinson on the TV getting me excited for my Christmas present to myself #DeadFunny,Azul_76
2173,902723926035501056,First Drug Approved for Dyskinesia in Parkinson's Disease https://t.co/NsfH4wfWN0 via @michaeljfoxorg none,NeuroBalance
2174,905597348121788416,Australian journalist &amp; writer Peter Luck has died at 73 after long battle with Parkinson's disease. #7News https://t.co/Nj3w94im0t,7NewsAdelaide
2175,905542711561920513,Why Your Nose May Be Key to Parkinson's Risk - https://t.co/vS0Tu6v2E0,Drugscom
2176,812636451204661249,Notes for Carers/Caregivers of People with Parkinson's  https://t.co/6ysSdoD1fz #wellness,DrGarySharpe
2177,813010954086739968,"Eat #Organic! #Pesticides r hormone disruptors n can cause allergies, #diabetes,autism,Parkinson,weight gain/#obes… https://t.co/hAQYcveoRc",Seattle_Diners
2178,905543164215169025,Medical News Today: Antidepressants could delay Parkinson's progression https://t.co/TMuPEAEGvT https://t.co/fzbxQk2kMd,preventandcure
2179,813174236907008000,My favorite George Michael Song - George Michael - A Different Corner (Live On BBC Parkinson Show) https://t.co/woneOeM5bm via @YouTube,konserncitzen
2180,812765581464244226,Work expands to fill the time available for its completion. - Parkinson's Law,brybuckley
2181,812738918512619520,Anyone else with Parkinson's having time issues? I can't remember whether something happened last week or last year. https://t.co/DOqS1Qy14x,YumaBev
2182,812840648751583232,Info: #Colloidal #gold has been used as #alternativemedicine for #brain related issues like #Parkinson #disease: https://t.co/7ucPL3zzdF,VeganHealthDiet
2183,812685091684155393,"Gently simmer cheap orange. Pour down plug hole. Excellent unblocker if, as I do, you use hemp oil for soap to avoid Parkinson's dominance.",existais
2184,813177126568558592,This is beautiful... George Michael - A Different Corner (Live On BBC Parkinson Show) https://t.co/io9ItWsBEf,WilliamsBob75
2185,812858416406425604,"Parkinson's Fifth Law:If there is a way to delay in important decision, the goodbureaucracy, public or private, will f",roboko_001
2186,813210550079463424,George Michael performing A Different Corner on Parkinson in 1998. Even more moving than the original. https://t.co/ofzaMeU4Bi @siricho4,aquilanebula
2187,812758164970020864,#Parkinson's patients may need to brush their teeth thoroughly for at least 3 minutes for good oral hygeine,ParkinsonsMeds
2188,905783879637889025,#Science A test that involves drawing a spiral on a sheet of paper could be used to diagnose early Parkinson's dis… https://t.co/8V9ovHo2Q6,herestheloop
2189,812568798331080705,Work expands so as to fill the time available for its completion. ~C. Northcote Parkinson #jobSearch https://t.co/PICtdiLyR5,CareeResourceIn
2190,812662215425851392,The latest The Power Surge Daily! https://t.co/Cu4a8055dz Thanks to @muz4now #parkinson #xmasbmj,PowerSurgeMaryO
2191,812966871095984128,"For Partner Andrew Parkinson, PPP is a franchise opportunity with a respected track record &amp; proven investment model https://t.co/DUCzxcX5FF",PPPFranchise
2192,902619827650560000,I liked a @YouTube video https://t.co/tKAjcOyGGB NEW Louis Parkinson Series Coming Soon... | Climbing Daily Ep.998,TiSavoie
2193,813191863763140608,some pretty good George Michael interviews from 1998: David Letterman https://t.co/QLV8F823um Michael Parkinson https://t.co/E07YAYujLH #rip,sumayyaka
2194,905527782502957056,Web seminar next week: Nutrition and Parkinson’s Disease. https://t.co/psd8yPscJS,ASAging
2195,813178048166170624,"I also loved his ability to make fun of himself: the Outside video, the Parkinson interview, the appearance on Extras :) #ripgeorgemichael",TobyDSmith
2196,905543032304537603,"#183 Nansie Sharpless was biochemist who studied L-Dopa &amp; Parkinson’s, pursued PhD despite admissions director's opposition as she was deaf https://t.co/DLTZEXVdVB",365womeninSTEM
2197,812980396447199232,Have you heard #Anal #parkinson #project by pablito el drito on #SoundCloud? https://t.co/2w4rAFgoT9 #8bit #chiptune #post #techno #gameboy,rxstnz
2198,812917557955088384,"New disease may provide hope for Alzheimer's, Parkinson's patients  https://t.co/r8oxlu5xpF",cbinflux
2199,905589316881080320,Scientists Gain Insight About How to Control Parkinson's Movement - https://t.co/IInP7cjE26 https://t.co/UEYtbqcYi8,EPCARE_Trials
2200,813037081857552384,"@garybrannan Mum has COPD and Parkinson’s, sis has MS so this time of year is never easy. Thanks for your concern though, it does help.",UsrBinPRL
2201,812539474638880768,Exercise May Be Real Medicine for Parkinson's Disease https://t.co/FVYluZmAkz #navishealth,impactmeds
2202,812664297058893824,One week of drinking my weight in prosecco before going sober for Cancer Research. Your support makes a difference: https://t.co/L5t5nj3rH9,joy_parkinson
2203,812736452664639488,'How long are you likely to have Parkinson’s?’ asked the woman assessing his claim. https://t.co/mZUpybgF4k,RednorthUK
2204,813220293183467521,Playing with Cards for Parkinson's Therapy  https://t.co/upP3xWcKr1 #gambling,DrGarySharpe
2205,813176670727245829,"#PoWRetro ""Pitch of the week #3: Treating Parkinson's Disease with Dance"" https://t.co/MQWcemSCq6 by @FaffRobert on @LinkedIn",FaffRobert
2206,902643283096166400,The nasal and gut microbiome in Parkinson's disease and idiopathic rapid eye mo... https://t.co/MkoG3umNnx,Ashu_Mangalam
2207,812942583060172800,Katherine Parkinson looks beautiful on Weekend at Christmas 😍✨,_chandelierbing
2208,903007439964053504,What Is Young-Onset Parkinson's Disease? - https://t.co/bErULOB2u4 https://t.co/BkL1uXmrVB,MleeGrp
2209,902619522305212416,"Cancer Drug That Might Slow Parkinson's, Alzheimer's Headed For Bigger Tests https://t.co/TiEQkqcYPA #alz,#caregiver",DementiaToday
2210,905536113925918720,New diagnostic tool spots first signs of Parkinson's disease https://t.co/ZQUSIAwPvI via @medical_xpress,danvzla
2211,812977885258612736,"Designer With Parkinson’s Was Unable To Work, Then Engineer Invents Bracelet That Changes Her World Fo... https://t.co/iKQDhVnsiZ via @janh1",ParkinsonsNws
2212,812573826517258240,@JohnTorode1 @SaturdayKitchen @OliasGastronomy @TheoRandall @Charitchie @jane_parkinson a breath of fresh air on Saturday Mornings 👍😊😊,darrelldr
2213,813043582449942530,@art_parkinson @ShannonTindle_1 @kevinbparry I got Kubo as a Christmas gift! Excited to watch this awesomeness again! https://t.co/9CnBfmsxkL,loveisworry14
2214,812696623977467904,"Celebrating 1st 10 yrs of Marching Black &amp; Gold! Congrats, dirs. Schwartzer and Parkinson, the great kids and all who dreamed. #musicfamily https://t.co/9DMp6iNiDW",hvartscouncil
2215,813056727323181056,My Niume Creative Writing Challenge for Out-Thinking Parkinson's  https://t.co/5Ve07XHWAS #creativewriting,DrGarySharpe
2216,812674420363980800,"#Prion detection improves, moves into blood and #Parkinson’s. #Alzforum https://t.co/NJwAl00Zhi",alzforum
2217,813159896141152257,Importance of Music Therapy for Parkinson's  https://t.co/j5aefrHaW0 #parkinsons,DrGarySharpe
2218,812894704316674048,I added a video to a @YouTube playlist https://t.co/lwapiZ9br5 The Parkinson - เพื่อนรัก (Dear Friend) | (OFFICIAL,Bikinisoft
2219,812757538630434816,"@PaulCarmichaelV @claytonhickman A new one - or ""that one with Michael Parkinson""",iantempest56
2220,905803861780201473,Re-Learning Relaxation (Anti-Stressing) with Parkinson's Disease https://t.co/wcIGMiCIRC #health https://t.co/mLMqKCnLGl,DrGarySharpe
2221,812769908400324608,A device that helps people with Parkinson's Disease write again. https://t.co/ikaPYXfC1K,lukasz_x2
2222,813208722491248640,"Parkinson's Fifth Law: If there is a way to delay in important decision, the good bureaucracy, public or private, will find it.",magwurgs
2223,813121648408850432,"10% CashBack on Kubo and the Two Strings (Blu-ray + DVD + Digital HD) Charlize Theron (Actor), Art Parkinson… https://t.co/toSvINnjbg",AndrewTexan
2224,813173550286782464,I went to watch a filming of 'Parkinson' years ago. George Michael was on it. Was amazing to watch a legend so closely and intimately.,dazgale
2225,813021604087218177,.@MichaelOkun and @UFHealth neuromedicine team relieve Parkinson's disease symptoms in patients https://t.co/bKXokJYhGH via @NatGeo https://t.co/KKpzmICgR0,UFexplore
2226,905794130080563200,Research findings associate coffee drinking with lower rates of dementia and Parkinson’s disease. https://t.co/LfFl5IuGrs,RonaLewis
2227,905608194562473985,New diagnostic tool finds first signs of Parkinson's https://t.co/xFR7wFEAJU,newsline
2228,812543347227234304,Why I'm Trying Light Therapy Glasses for Parkinson's Disease  https://t.co/qz4P568E3T #science,OutThinkBiz
2229,812813424723800064,This #innovative new treatment may provide newfound #hope for Parkinson's patients @OSUWexMed https://t.co/jz2DoX3HSC,DoctorAliRezai
2230,903019062502051844,"Me: *Explains dances of drum and bass at arena*
Dad: ""Maybe they just have Parkinson's""",frazzlebudd
2231,902671858402775040,Congratulations to Coach Parkinson on receiving a contract extension through the 2021-2022 season! #JagsROAR https://t.co/zHohM4hVaO,IUPUILadyJags
2232,812979431400755200,New Disease may Provide HJope for Alzheimer's and Parkinson's Patients https://t.co/tqZfJFNlEZ https://t.co/zKJkiX6A4e,crazyarchitect
2233,812932792996663297,"New disease may provide hope for Alzheimer's, Parkinson's patients https://t.co/oOyz8CPkgN",punjabtribune
2234,813053623676633089,"Parkinson's Law: Work expands to fill the time available for its completion. 
-C Northcote Parkinson",SkuldLLC
2235,813152581895782400,Don't think I've ever seen something as cute as penny parkinson 💕,EKBaines
2236,813224303235923969,"2 The Truth About Lesions, DaTscan, Parkinson's and MS https://t.co/WecVjfcGWu via @YouTube",UmYusuf61
2237,812740884810887168,How To Stay Healthy with Parkinson's Disease  https://t.co/BQjvRHMSbU #parkinsons,DrGarySharpe
2238,812920384920043520,"New disease may provide hope for Alzheimer’s, Parkinson’s patients
https://t.co/eY1Qgm4ZlB https://t.co/soPP4e3vSV",windowtonews
2239,905535933235257345,"If You Can’t Smell Gasoline or Cinnamon, You Might Be Developing Parkinson’s https://t.co/pqWs6gsJh0",fpizart
2240,903001797576593418,"The Parkinson Court is ready! Registration desk set up, rooms checked and delegate bags packed! See you tomorrow #BAAL2017 @meetinleeds",BAAL2017
2241,813082681680465920,I wrap presents with the skill and accuracy of a T-Rex with Parkinson's #ChristmasMiracle,ChristiCrashed
2242,812627534382821377,"It's nearly that time of year again! 

⚽️Ian Hume Memorial Shield
🗓 Tue 27th Dec 
🕑 14:00
💰 donation to Borders branch of Parkinson's UK https://t.co/1iE81siFsE",fairydeanrovers
